mysql> SELECT * FROM employee_payroll;
+----+----------+--------------+---------+------------+--------+-----------+------------+-------------+-----+---------+------------+
| id | name     | phone_number | address | department | gender | basic_pay | deductions | taxable_pay | tax | net_pay | start      |
+----+----------+--------------+---------+------------+--------+-----------+------------+-------------+-----+---------+------------+
|  1 | Nishant  | NULL         | NULL    |            | M      |   1000000 |          0 |           0 |   0 |       0 | 2019-05-08 |
|  2 | Ujjwal   | NULL         | NULL    |            | F      |   2000000 |          0 |           0 |   0 |       0 | 2018-01-01 |
|  3 | Anshuman | NULL         | NULL    |            | M      |   3000000 |          0 |           0 |   0 |       0 | 2022-05-30 |
+----+----------+--------------+---------+------------+--------+-----------+------------+-------------+-----+---------+------------+
3 rows in set (0.00 sec)

mysql> UPDATE employee_payroll SET department = 'Marketing' WHERE name = 'Ujjwal';
Query OK, 1 row affected (0.01 sec)
Rows matched: 1  Changed: 1  Warnings: 0

mysql> SELECT * FROM employee_payroll;
+----+----------+--------------+---------+------------+--------+-----------+------------+-------------+-----+---------+------------+
| id | name     | phone_number | address | department | gender | basic_pay | deductions | taxable_pay | tax | net_pay | start      |
+----+----------+--------------+---------+------------+--------+-----------+------------+-------------+-----+---------+------------+
|  1 | Nishant  | NULL         | NULL    |            | M      |   1000000 |          0 |           0 |   0 |       0 | 2019-05-08 |
|  2 | Ujjwal   | NULL         | NULL    | Marketing  | F      |   2000000 |          0 |           0 |   0 |       0 | 2018-01-01 |
|  3 | Anshuman | NULL         | NULL    |            | M      |   3000000 |          0 |           0 |   0 |       0 | 2022-05-30 |
+----+----------+--------------+---------+------------+--------+-----------+------------+-------------+-----+---------+------------+
3 rows in set (0.00 sec)

mysql> INSERT INTO employee_payroll
    -> (name, department, gender, basic_pay, deductions, taxable_pay, tax, net_pay, start) VALUES
    -> ('Ujjwal', 'Sales', 'F', 4000000.00, 1000000.00, 3000000.00, 300000.00, 2700000.00, '2020-06-01');
Query OK, 1 row affected (0.07 sec)

mysql> SELECT * FROM employee_payroll;
+----+----------+--------------+---------+------------+--------+-----------+------------+-------------+--------+---------+------------+
| id | name     | phone_number | address | department | gender | basic_pay | deductions | taxable_pay | tax    | net_pay | start      |
+----+----------+--------------+---------+------------+--------+-----------+------------+-------------+--------+---------+------------+
|  1 | Nishant  | NULL         | NULL    |            | M      |   1000000 |          0 |           0 |      0 |       0 | 2019-05-08 |
|  2 | Ujjwal   | NULL         | NULL    | Marketing  | F      |   2000000 |          0 |           0 |      0 |       0 | 2018-01-01 |
|  3 | Anshuman | NULL         | NULL    |            | M      |   3000000 |          0 |           0 |      0 |       0 | 2022-05-30 |
|  4 | Ujjwal   | NULL         | TBD     | Sales      | F      |   4000000 |    1000000 |     3000000 | 300000 | 2700000 | 2020-06-01 |
+----+----------+--------------+---------+------------+--------+-----------+------------+-------------+--------+---------+------------+
4 rows in set (0.00 sec)